8501749	http://en.wikipedia.org/wiki/Jaret_Reddick	Jaret Reddick. Jaret Ray Reddick (born March 6, 1972) is an American singer-songwriter, guitarist, composer, and voice actor, best known as the lead vocalist, rhythm guitarist, and primary songwriter for the Grammy Award-nominated pop punk band Bowling for Soup. He plays a Music Man Axis that has a flag of Texas design on it. Background. Jaret Ray Reddick was born in Grapevine, Texas. He is the youngest of six children, with four sisters and a brother (named Danny). He went to Cunningham Elementary School, Wichita Falls, Texas. He graduated from S.H. Rider High School in Wichita Falls. In high school, he played snare drum in the marching band. Jaret has degrees in business management and psychology from Midwestern State University in Wichita Falls. Jaret loves games, which is the inspiration for the tattoo sleeve on his right arm, which includes such things as a Rubik's Cube, a Fisher-Price Chatter Telephone, jacks, Monopoly's Rich Uncle Pennybags, and Operation's Cavity Sam. The most recent addition is Mr. Potato Head. He has owned a chain of toy stores and worked in real estate while attempting to get his music career off the ground. He is married to Melissa Reddick, and has two children, Emma and Jack, and resides in a small community outside of Denton, Texas. Bowling for Soup. Bowling for Soup formed in 1994 in Wichita Falls, Texas. Their name derives from Bowling For Soup, a comedy routine by Steve Martin. Jaret is the songwriter for the band, penning such BFS hits as "Punk Rock 101", as well as playing rhythm guitar. He also likes Iron Maiden, with his favourite song being "Paschendale", inspired by his old history teacher Dave McGill. "Phineas and Ferb". Reddick's biggest project outside of Bowling for Soup is song writing and appearing as the lead singer of the fictional band Love H?ndel on the television show "Phineas and Ferb". It started with Bowling for Soup providing the series' theme song "Today is Gonna Be a Great Day," and later Reddick's character Danny was introduced in the episode "Dude, We're Getting the Band Back Together". Reddick has since written several songs for the show and made a handful of appearances, both as Danny from Love H?ndel, and once with cartoon versions of the other members of Bowling for Soup performing "Today is Gonna Be a Great Day." "Sonic Unleashed". Reddick also worked with SEGA for the song "Endless Possibility", which is featured as the theme to the "Sonic the Hedgehog" videogame, "Sonic Unleashed". The song was co-written by other members of SEGA's sound team, including longtime "Sonic" game composer, Jun Senoue. Jarinus. Jarinus is a songwriting/production team composed of Reddick and Linus of Hollywood. The two have worked together co-writing songs for and co-producing the Bowling for Soup albums, "Sorry for Partyin'" (2009) and "Fishin' for Woos" (2011), as well as co-founding Crappy Records, and co-producing the People on Vacation EP "The Carry_On EP" (2011). In late 2011, Jarinus announced that they would be making their debut album and that the they would be seeking funding for recording it through Kickstarter, and have since reached their goal of over $18,000. The duo began releasing demo recordings as free downloads, as a "song of the week" promotion, on SoundCloud. However, Reddick later stated these songs would not appear on the album. Crappy Records. Crappy Records is an independent record label started by Reddick and Linus of Hollywood as a partnership with Oglio Records. The label has released albums from Kurt Baker, The Leftovers, Linus of Hollywood, MC Lars, and Skyfox. Built By Ninjas. Built By Ninjas is a music video production group formed by Reddick and Heath Balderston. The group has produced music videos for MC Lars, Patent Pending, Palmdale, and Skyfox, as well as Bowling for Soup's music video for the song "Turbulence" and People on Vacation's video for the song "Where Do We Go." People on Vacation. In 2010, Reddick started a side project band, called People on Vacation, with Ryan Hamilton from the indie rock band Smile Smile. The duo have since released two songs online. The first, "Better Off Dead" was released in late 2010, and a second, "She Was the Only One" was released in early 2011. A video for "Better Off Dead has also been released. The duo released their debut EP "The Carry_On EP" on November 24th, 2011, through Brando Records. The Boster. The Boster in 2011 in Australia, Reddick as Edd Jones. From virtual band called The Boster. Chuck E. Cheese. In 2012, Chuck E. Cheese's chose Reddick to be the new voice of their mascot, Chuck E. Cheese, as part of a revamp for the character. He replaces Duncan Brannan in the role.
8501754	http://en.wikipedia.org/wiki/Michael_Goblet_d%27Alviella	Michael Goblet d'Alviella. Count Michael Goblet d'Alviella is a Belgian liberal politician, counsel-general, and mayor of Court-Saint-Etienne. He is a son of Jean Goblet d'Alviella.
8501755	http://en.wikipedia.org/wiki/England_Basketball	England Basketball. England Basketball is the governing body of the sport of basketball for England. The organisation operates the English Basketball League for both Men and Women, as well as the England national team. The organisation was also involved in the establishment of the Great Britain team in December 2005, along with its compatriots ? Basketball Scotland and Basketball Wales. Whilst the organisation governs the British Basketball League, the country's elite and only professional basketball league, they are not involved in the day-to-day running of the league. The organisation was founded in 1936. It is a non-profit organisation which is an association of member clubs and players who elect an Executive Board to administer their affairs. The Executive Board employ a number of professional staff to enable it to undertake its duties and achieve its aims. The headquarters of the organisation is in Sheffield.
8501783	http://en.wikipedia.org/wiki/Donald_Vance	Donald Vance. Donald Vance (born c. 1976) is an American Navy veteran who was held in detention at Camp Cropper, the United States military's maximum-security detention site in Baghdad for 97 days beginning in April 2006. On December 18, 2006, Vance filed suit against the US government and the former US Secretary of Defense, Donald H. Rumsfeld, on grounds that he was tortured and his rights of habeas corpus were violated. He won the 2007 Ron Ridenhour Truth-Telling Prize for coming forward with his story on April 4, 2007. Background. Vance was a 29-year-old Navy veteran from Chicago when he went to Iraq as a security contractor. Vance became an unpaid informant for the F.B.I., passing them evidence that seemed to suggest that the Iraqi security firm at which he worked might be engaged in illegal weapons trading, particularly to officials from the Iraqi Interior Ministry. However, when American soldiers raided the firm, he was treated as a suspect. Another American who worked for the company but had resigned over the alleged weapons trading, Nathan Ertel, was also detained. Vance was held for three months at Camp Cropper, America?s maximum security prison site in Baghdad. Incarceration. Vance claims he was subject to interrogations, inhumane treatment and sleep deprivation techniques during his time at Camp Cropper. A Pentagon spokesperson, First Lt. Lea Ann Fracasso, claimed the men had been "treated fair and humanely", and that there was no record of either man complaining about his treatment. Though officials were informed by his F.B.I. handler that he was an informant after his first three weeks of detention, they decided that he still "posed a threat". He took notes on his imprisonment and smuggled them out in a Bible. Although denied legal representation at his detainment hearing on 24 April, he was allowed to attend it because he was an American. Two weeks into his detention, he was allowed to phone his fiancee in Chicago, who had already informed her Congressional representative of his apparent disappearance. He wrote ten letters home, one of which arrived in November 2006 dated 17 July. After three months, officials decided to release him after further review of his case. Legal case. On December 18, 2006, Vance filed suit against the US government and the former US Secretary of Defense, Donald H. Rumsfeld, on grounds that he was tortured and his rights of habeas corpus were violated. He is being represented by Arthur Loevy, Jon Loevy and Michael Kanovitz of the law firm Loevy & Loevy. On September 21, 2007, Vance testified before a Senate Democratic Policy Committee on abuses in private security and reconstruction in Iraq during a hearing on Capitol Hill. He spoke about several events such as Shield Group Security brokering a deal with the South Korean government for small arms. He also spoke about Shield Group selling small arms to people operating within the U.S State Dept. During the proceeding Senator Byron Dorgan who chaired the committee asked Vance to turn over documents reflecting these weapon sales. Vance stated he would do so and also include hundreds of other pages including emails, photos and other documents reflecting SGS's criminal activities. On September 26, 2007 during an Appropriations Committee hearing, Senator Byron Dorgan asked Secretary of Defense, Robert Gates to investigate the detention of Donald Vance. Senator Dorgan also relayed during the committee hearing that he has submitted a request to the inspector generals office for a complete investigation. Sen. Dorgan called Vance's detention by the U.S military "frightening". On August 8, 2011, the United States Court of Appeals for the Seventh Circuit in Chicago ruled that Vance and Nathan Ertel may proceed to sue Rumsfeld. Unless overturned, the ruling will allow these two plaintiffs to subpoena government documents and to compel sworn testimony about U.S. torture policies. In the past, courts have generally refrained from allowing such suits related to federal government conduct in zones of military conflict, granting government agents qualified immunity under the Bivens doctrine. In its opinion, the Court asked, "On what conceivable basis could a U.S. public official possibly conclude that it was constitutional to torture U.S. citizens?" With reference to the defendants' arguments for immunity, the Court wrote that "The [defense] theory would immunize every enlisted soldier in the war zone and every official in between ? for deliberate torture and even coldblooded murder of civilian U.S. citizens." In October of 2011, however, the 7th Circuit agreed to rehear the case en banc, vacating the prior opinion.
8501798	http://en.wikipedia.org/wiki/Marie-F%C3%A9licit%C3%A9_Brosset	Marie-F?licit? Brosset. Marie-F?licit? Brosset (January 24, 1802 ? September 22, 1880) was a French orientalist who specialized in Georgian and Armenian studies. He worked mostly in Russia. Biography. Marie-F?licit? Brosset was born in Paris into the family of a poor merchant who died a few months after Marie-F?licit?'s birth. Education and first works. His mother destined him to the Church. He attended the theological seminaries in Orl?ans, where he studied Greek, Latin, Hebrew, and Arabic. Back to Paris, he attended lectures delivered at the Coll?ge de France by Carl Benedict Hase, for Greek, Antoine-Isaac Silvestre de Sacy for Arabic and Jean-Pierre Abel-R?musat for the Chinese languages. He was elected to the Asiatic Society in 1825. Eventually, says his son Laurent, "after five years of unceasing effort, he suddenly gave up" and burned all the material he had painfully built. From 1826 he devoted himself to the Armenian and Georgian languages, history and culture. He had found his true vocation. Books, teachers, documents were however scarce. For Armenian he was helped by Antoine-Jean Saint-Martin. For Georgian he had to create his own dictionary from the Georgian translation of the Bible, which is truthful to the Greek text. Russia. Invited to Saint Petersburg in 1837 by Count Sergey Uvarov, president of the Imperial Academy of Sciences, he was elected a member a year later. He journeyed to the Caucasus in 1847-48. He translated and commented on all major medieval and early modern Georgian chroniclers and published them in seven volumes from 1849 to 1858. His magnum opus, "Histoire de la G?orgie", was a long-standing authority on the history of Georgia. He also published the correspondence between the tsars and the kings of Georgia from 1639 to 1770. He devoted the years 1861?1868 mainly to his series on Armenian historians, but continued to work on them until 1876. Overall, Brosset authored over 250 works pertaining to Georgian and Armenian history and culture. He left Russia in May 1880 et and retired at his daughter's in Ch?tellerault. He died there a few months later. His son Laurent's analytic bibliography was a major contribution to the knowledge of his life and works.
8501805	http://en.wikipedia.org/wiki/Zherdevka_(air_base)	Zherdevka (air base). Zherdevka (also Zerdevka) is an interceptor aircraft air base in Russia located 7?km east of Zherdevka, Tambov Oblast. It was home to the 14th Guards Leningrad Twice Red Banner Order of Suvorov Fighter Aviation Regiment (14th Guards IAP) which flew MiG-29E aircraft from 21 April 1991 through the mid 2000s. In 1998 (Butuwski) or 1999 (M. Holm) the regiment moved to Khalino, near Kursk.
8501807	http://en.wikipedia.org/wiki/Ichigaya_Station	Ichigaya Station. is a railway station located in Chiyoda, Tokyo, Japan. The ground-level section of the station is managed by the East Japan Railway Company (JR East) and the underground sections are managed by Tokyo Metro and Tokyo Metropolitan Bureau of Transportation (Toei Subway). The station is served by the JR Ch??-S?bu Line, Tokyo Metro Y?rakuch? Line, Tokyo Metro Namboku Line, and Toei Shinjuku Line. Ch?? Line rapid services pass the station. Under the station numbering system of Tokyo subway, Ichigaya Station is represented by Y-14 on the Y?rakuch? Line, N-09 on the Namboku Line and S-04 on the Shinjuku Line. The headquarters of the Ministry of Defense of Japan and of the Japanese Go Association are located in the vicinity of Ichigaya station.
8501815	http://en.wikipedia.org/wiki/2006%E2%80%9307_Campionato_Sammarinese_di_Calcio	2006?07 Campionato Sammarinese di Calcio. The 2006-07 Campionato Sammarinese di Calcio season is the twenty-second season since its establishment.
8501820	http://en.wikipedia.org/wiki/United_Family_Services	United Family Services. United Family Service (UFS) is a not-for-profit, family service organization based in Charlotte, North Carolina, with offices in Concord, Huntersville, Monroe and Mooresville, NC. United Family Services is a member of United Way of Central Carolinas, Inc. and is accredited by the Council on Accreditation. History. United Family Services was founded in 1882 by 100 religious and business leaders who pledged $25 a year each to support the work of the organization. With offices in Cabarrus, Mecklenburg, Mooresville/S. Iredell and Union counties, United Family Services has 84 full-time employees and more than 250 active volunteers.
8501825	http://en.wikipedia.org/wiki/Buzludzha	Buzludzha. Buzludzha (- lit. meaning "glacially/icy") is a historical peak in the Central Stara Planina, Bulgaria and is 1441 metres high. In 1868 it was the place of the final battle between Bulgarian rebels led by Hadji Dimitar and Stefan Karadzha and the Turks. The Buzludzha Monument on the peak was built by the Bulgarian communist regime to commemorate the events in 1891 when the socialists led by Dimitar Blagoev assembled secretly in the area to form an organised socialist movement. It was opened in 1981. No longer maintained by the Bulgarian government, it has fallen into disuse. Buzludzha is reached by a 12?km side road from the Shipka Pass. Now the monument is abandoned, vandalised, and devastated.
8501846	http://en.wikipedia.org/wiki/Nick_Thornicroft	Nick Thornicroft. Nicholas David "Nick" Thornicroft (born 23 January 1985, York, England) is an English first-class cricketer. He is a left-handed batsman and a right-arm medium-fast bowler, who played first-class cricket for Yorkshire County Cricket Club from 2002 until 2007. Career. Thornicroft made his debut for the Yorkshire Cricket Board in 2001, in the Cheltenham & Gloucester Trophy. He played in his debut first-class match for Yorkshire CCC in the 2002 County Championship, although Yorkshire finished that season in bottom place in the First Division, being relegated to Division Two for the 2003 season. Thornicroft held the lowest first-class bowling average of the Yorkshire team in 2002. He was the youngest ever Roses Match debutant, that year, when he played for Yorkshire against Lancashire at the age of 17. Thornicroft appeared in only one first-class match during the following season, although he played in five Youth One Day Internationals and three Youth Tests during the calendar year of 2003, both during an English tour of Australia, before coming back home and playing two Youth Tests against South Africa. Thornicroft spent 2004 and 2005 playing little first-class cricket, although he continued in a consistent vein of form when sent out on loan to Essex's Second XI. During the 2006 season, Thornicroft played no first-class matches. He was subsequently released by Yorkshire in 2007. Personal life. Thornicroft is a supporter of his hometown football club, York City F.C.
8501875	http://en.wikipedia.org/wiki/Basilica_of_the_National_Shrine_of_Our_Lady_of_Fatima	Basilica of the National Shrine of Our Lady of Fatima. The Basilica of the National Shrine of Our Lady of Fatima is a Minor Basilica and National Shrine of the Roman Catholic Church located in Lewiston, New York, USA, north of Niagara Falls, honoring the Blessed Virgin Mary as Our Lady of Fatima, the Patroness of the United States. It is directed by The Barnabite Fathers Thousands of pilgrims from around the country and the world visit the basilica each year. The basilica is located on 16 acreas of land. Notable buildings, objects and settings on the property include the Basilica, Bell Tower, Shrine of St. Anthony Mary Zaccari, Little Chapel of Fatima, The Avenues of Saints, Shrine of Mother Cabrini, the Giant Rosary, the Peace Mural, the Blessed Sacrament Chapel, the Immaculate Heart Chapel, The First Chapel, and the Barnabite Father?s Seminary. History. First among the many Shrine benefactors were Mr. & Mrs. Walter Ciurzak who, in 1954, donated of their farm land for the construction of the Shrine. The Basilica was started in 1963. The Church was dedicated in 1965 and was consecrated on October 5, 1974. On October 7 1975, his Holiness Pope Paul VI, conferred the title of Basilica upon this church. The Basilica sits in a dome measuring in diameter and high. The dome is covered with two layers of glass and acrylic glass depicting a contour of the Northern Hemisphere. On top of this dome rests a beautiful statue of Our Lady of Fatima which is high and weighs 10 tons. The statue was sculpted from Vermont granite. The tall Bell Tower was built during the 25th Anniversary Year, 1981, and is dedicated to the memory of Fr. Charles M. Barlassina, C.R.S.P.
8501900	http://en.wikipedia.org/wiki/Povorino_(air_base)	Povorino (air base). Povorino is an air base in Russia located 13?km southwest of Povorino. It was an attack deployment base to be used in wartime, and contained no facilities of note.
