8502142	http://en.wikipedia.org/wiki/Newmarket%2C_County_Cork	Newmarket, County Cork. Newmarket, historically known as Aghatrasna (), is a town in the Barony of Duhallow, County Cork, Ireland. Twin towns ? Sister cities. Kevin O'Driscoll,Election agent to Irish President Michael D. Higgins in the 2011 Irish Presidential Election was born in High Street Newmarket in 1946. He was Government Programme Manager to the Irish Minister for Arts Culture and the Gaeltacht from 1993-1997. his late father Sean was a founder member of the local GAA club.
8502152	http://en.wikipedia.org/wiki/Lebedovo	Lebedovo. Lebedovo (also Dolinniye) was an air base in Russia located 18?km southeast of Privolzsky. It appeared on Department of Defense aeronautical charts dating from the 1960s and 1970s. It was probably a local diversion site for Engels bombers. It is now a dairy farm and the runways have been scrapped.
8502170	http://en.wikipedia.org/wiki/Preiner_Gscheid_Pass	Preiner Gscheid Pass. Preiner Gscheid Pass (el. 1070 m.) is a high mountain pass in the Austrian Alps in the "Bundesland" of Lower Austria. The pass connects Kapellen and Reichenau an der Rax.
8502171	http://en.wikipedia.org/wiki/Igreja_de_S%C3%A3o_Francisco_(%C3%89vora)	Igreja de S?o Francisco (?vora). The Igreja de S?o Francisco (Church of St. Francis) is located in ?vora, Portugal. It is best known for its lugubrious Chapel of the Bones. This huge church was built in Gothic style (with some Manueline influences) between 1475 and the 1550s to the design of Martim Louren?o, replacing an earlier Romanesque church of 1226. This church is one of a kind through its narthex with arcades in front of the church. The arcade is formed by seven arches with different forms (semicircular, pointed or horseshoe arches), a typical blend of Gothic and Moorish elements. The battlemented fa?ade has conical or spiral-shaped spires. The Manueline entrance to the church carries above a pelican, emblem of king Jo?o II and an armillary, emblem of king Manuel I. The church shows majestic proportions: 36 x 34 x 24 m. The single, groin-vaulted nave gives a wide impression, accentuated by the white mortar on the walls and the columns. This is the largest nave of this kind to be found in Portuguese churches. The spacious vault of the crossing rests on ogival arches. The father of Portuguese drama Gil Vicente is buried at the left side of the entrance. The chancel (early 16th century) with the main altar (from a later date) displays Renaissance features. But the choir stalls were made in different art styles: the right one in Renaissance, the left in Baroque style. The altars in the transept are decorated with gilded sculpturework ("talha dourada") framing 16th century panels, probably painted by Flemish artists. The sides of the nave contain twelve open chapels, built between the buttresses of the wall.
8502176	http://en.wikipedia.org/wiki/I._birlik_sitesi	I. birlik sitesi. I. Birlik Sitesi is one of the oldest site of Erdek, in the Bal?kesir Province in the Marmara region of Turkey, locates at the seaside in Cugra direction. In 1966, the site was made by a Turkish architect, also it is the first Swedish style enema structure that was formed in Turkey.
8502197	http://en.wikipedia.org/wiki/Andes_physics_tutor	Andes physics tutor. Andes is an intelligent tutoring system designed to help students to solve physics problems. Topics covered. Andes is designed to be the homework component of an introductory physics course. It covers all of the topics in a standard two-semester introductory physics course, except for modern physics and thermodynamics. It does not include problems involving calculus.
8502204	http://en.wikipedia.org/wiki/Anne_Mather	Anne Mather. Anne Mather is the pseudonym used by Mildred Grieveson (b. October 10, 1946 in England), a popular British author of over 160 romance novels. She also signed novels as Caroline Fleming and Cardine Fleming. Mildred Grieveson began to write down stories in her childhood years. The first novel that she actually finished, "Caroline" (1965), was also her first book to be published. Her novel, "Leopard in the Snow" (1974), was developed into a 1978 film. Personal life. Mildred Grieveson was born on October 10, 1946 in England. She always wanted to write, and for years she wrote for her own pleasure. She had written all through her infant and junior years and on into her teens, the stories changing from children's adventures to torrid gypsy passions. Her mother used to gather these up from time to time, when her bedroom became too untidy, and disposed of these manuscripts. Mildred married very young and became a housewife. Her husband suggested that she ought to send one of her stories to a publisher, but she had never finished one of her stories. Published at 19, she was newly married, and her daughter was just a baby, when she juggled her household chores and scribbled away in exercise books every chance she got. Now, she has two adult children, a son and a daughter, and two grandchildren, Abigail and Ben. Writing career. With her husband's encouragement, she finally finished a manuscript, "Caroline". When she was only 19, in 1965, Mills & Boon published "Caroline", and this became her first published book, signed under the pseudonym Anne Mather. The first novel to be issued entirely through M&B was Dangerous Enchantment in May 1969. (ref. Fantastc Fiction website).** In 1973, she became a launch author for the new Harlequin Presents line of category romance novels. Harlequin Presents books were more sensual than the previous line, Harlequin Romance, under which Anne Mather had been published. She was chosen to be a launch author because she, along with Violet Winspear and Anne Hampson were the most popular and prolific of Harlequin's authors. Her novel, "Leopard in the Snow" (1974), was developed into a 1978 movie.
8502209	http://en.wikipedia.org/wiki/CFLA-TV	CFLA-TV. CFLA-TV was the local CBC Television station in Goose Bay, Newfoundland and Labrador, Canada. It was an analogue rebroadcaster of CBNT-DT, the CBC station in St. John's. 1950s to 1970s. The station was founded by the US Air Force in 1957 via a Canada-United States agreement. The station's licence was held by the CBC (making it a CBC owned and operated television station), but it was maintained and operated by the USAF. The station was broadcast on VHF Channel 8 with an effective radiated power (ERP) of 348 watts (video) and 174 watts (audio). Programming. During the USAF's operation under CBC licensing, the programming became more varied. At that point in time, material was shipped to the CFLA studios from both the CBC and American Forces Network suppliers. Content was aired 50/50. In order to provide more American content, CFLA created a one hour teen dance show, similar to "American Bandstand". The "Jeffrey Wayne Show" was broadcast three times a week with both American and Canadian teenagers participating from Happy Valley and Northwest River. Under the CBC rules, this locally produced show counted as Canadian content, allowing the addition of three hours of American content. During the early 1960s, CFLA's programming schedule usually ran from 2:30 p.m. to 12:30 a.m. Two local newscasts were presented Monday - Saturday, and one on Sunday. The news copy was ripped and read off the wire, and visuals consisted of still pictures. The weatherman stood behind a large transparent glass map. By reversing the camera scanning it appeared that he had the special talent of writing and drawing the symbols backwards. It created much viewer interest, so much so that it was a top priority of many visitors to the station to see how it was done. The management in 1969 was M.A. "Tony" Grace as the CBC Management Representative, SSgt. Tom Stevenson as USAF NCOIC (General Manager), and Sgt. Jon "Dunbar" Wakayama as Program Director. During their tenure, CFLA created four different block programming formats, recruited local talent to sing jingles for the station, integrated the "CBC is for Lovers" TV campaign, and even had a parade rerouted to a road near the studio in order to broadcast the event. The CFLA-TV crew also produced a weekly news radio feature called "Pulsebeat" for CFGB-AM in Happy Valley. Since there was no network feed or videotape in 1969 to show the moon landing, the CFLA-TV crew rebroadcast the live CBC radio feed over an artistically selected series of slides to capture the feeling of that historical moment. A similar situation seven years earlier in 1962 during John F. Kennedy's historic Bay Of Pigs speech; the audio portion was picked up from CFGB radio while various file pictures of the president aired. The CBC also helped the station by sending cyclorama backdrops, set dressing, props and slides for the regularly scheduled news and entertainment programs such as "Panorama" and "Speaking of Sports with Gordie Rendell". They also provided an environmentally conscious news teletype, allowing viewers to follow the events of mercury poisoning of the fish in Placentia Bay. Because the CBC's time-sensitive programs had to be delayed by several weeks, viewers were treated to situations such as the Perry Como Thanksgiving Special airing close to Christmas. Since the majority of Christmas specials were pre-produced they aired on time. To keep the Canadian content balance, 55-45 at that time, CFLA produced a live show Monday - Saturday at 11:40 p.m. called "Midnight". Hosted by Marty Culpepper, it basically was a radio show on TV, consisting of music recordings over still pictures, a filmed short subject, cartoon, news headlines and tidbits off the wire. Saturday afternoons, during the winter months, a one hour teen dance show hosted by Mike Keene was produced locally. Occasionally, courtesy of the NCO Club, their entertainment provided several half-hour shows. It was a challenge to produce a show with a live band and singers in such a small studio with limited equipment. Operations. The studio was located in the basement of building S565. The transmitter, two studio cameras and switcher were Dage products. Telecine consisted of two 16mm RCA projectors and a 35mm slide projector. No videotape. Leo Harvey was the CBC Mgt. Rep. and Capt. William James, base information officer, was the military supervisor. The equipment for CFLA-TV originally was located at Loring AFB, Maine during 1954-56 due to the lack of commercial service in that area. The station was relocated to Goose Air Base once Presque Isle's WAGM-TV began broadcasting on channel 8 in 1956. 1970s to present. In 1973, the USAF formally transferred operations to the CBC. On March 1, 1988, the station's licence was renewed. The Canadian Radio-television and Telecommunications Commission (CRTC) also noted that CFLA was basically a rebroadcast transmitter of CBNT St. John's, aside from 3 hours and 20 minutes of locally-produced programming each week. Most of this programming was a ten-minute insert of the daily news and public affairs program "Here and Now" (from CBNT), and a 30-minute news and general interest program "Coffee Break", which aired on weekday mornings. Starting October 8, 1991, CFLA-TV was given approval to decrease its ERP from 6800 to 1930 watts. With this change, a new antenna system was installed, and the station became a full-time rebroadcaster of CBNT. Due to budget cuts handed down on the CBC in April 2012, the CBC has announced several austerity measures to keep the corporation solvent and in operation; this included the closure of the CBC and Radio-Canada's remaining analogue transmitters, including CFLA-TV, on July 31, 2012.
8502227	http://en.wikipedia.org/wiki/Moskovsky_District%2C_Russia	Moskovsky District, Russia. Moskovsky District is the name of several administrative and municipal divisions in Russia. The districts are generally named for Moscow, the capital of Russia.
8502228	http://en.wikipedia.org/wiki/Galaxias_(supermarkets)	Galaxias (supermarkets). Galaxias () is a supermarket chain in Greece, established in 1982. Its corporate name is PENTE SA and its headquartered in Athens. As of 2012, Galaxias has 132 stores, approximately half located in the greater Athens area and half in the rest of the country. Galaxias is the tenth biggest supermarket chain in Greece according to market share.
8502238	http://en.wikipedia.org/wiki/Cheney_Longville_Castle	Cheney Longville Castle. Cheney Longville Castle was in the village of Cheney Longville to the north of Craven Arms, Shropshire (). It is a much restored 14th century fortified manor house. The house is quadrangular in shape, 30.48 x 36.58m, and has the remains of its moat to the south and east. The entrance is on the north side through a modern archway. The residential arpartments form the North, and part East and West sides which were originally separated from the stable court in the south by a wall. History. In 1394, Hugh Cheney was granted a license to crenellate his manor house at "Longefeld". It was attacked and captured in the Civil War, suffering damage by cannon. The house was subsequently rebuilt. The manor was bought in 1682 by John Talbot who in turn sold it in 1745 to William Beddoes, whose descendants still own it.
8502241	http://en.wikipedia.org/wiki/Writer_Magazine/Emily_Dickinson_Award	Writer Magazine/Emily Dickinson Award. The Writer Magazine/Emily Dickinson Award is given once a year to a member of the Poetry Society of America "to honor the memory and poetry of Emily Dickinson, for a poem inspired by Dickinson though not necessarily in her style." The winner receives a $250 prize.
8502242	http://en.wikipedia.org/wiki/Oberjoch_Pass	Oberjoch Pass. The Oberjoch Pass (1178?m) is a mountain pass in the Allg?u Alps just one kilometre west of the Austrian border. It links Bad Hindelang, Schattwald and Jungholz. Between 1938 and 1945 the pass was called "Adolf-Hitler-Pass".
8502243	http://en.wikipedia.org/wiki/Switched_at_Birth_(film)	Switched at Birth (film). "Switched at Birth" is a 1991 television film directed by Waris Hussein. It is based on the true story of Kimberly Mays and Arlena Twigg, babies switched soon after birth in a Florida hospital in 1978. Plot. When Arlena Twigg becomes ill, a blood test reveals that she is not the biological daughter of Regina and Ernest Twigg. When Arlena dies at the age of nine, her parents search for their biological daughter who is being raised as Kimberly Mays. Factual basis. Kimberly Mays and Arlena Twigg were born within a few days of each other in a Wauchula, Florida hospital in November 1978. Kimberly went home with Bob Mays and his wife, Barbara, who died of ovarian cancer when Kimberly was three. Ernest and Regina Twigg of Sebring, Florida took home the Mays' biological daughter, whom they named Arlena. The Twiggs learned that Arlena had the wrong blood type to be their biological daughter at age 9. Following Arlena's death, the Twiggs sought information about their biological daughter and located Kimberly Mays, who was later the subject of a custody battle between her biological parents, and Bob Mays, the man who raised her after she was switched at birth. Bob Mays had agreed in 1989 to grant the Twiggs visitation rights to Kimberly, but later cut off the visits. The Twiggs then sued for increased visitation or custody of Kimberly. A Wauchula, Florida circuit court ruled in 1993 that Kimberly would be allowed to cut off all contacts with her biological family and that Bob Mays was her psychological father. Though Kimberly won the right to stay with Bob Mays, she later ran away and moved in with the Twiggs. Her early adulthood was troubled, as she battled marital woes and lost custody of her own child for a time. The court battle was also the subject of a book entitled "The Baby Swap Conspiracy" by Loretta Schwarz-Nobel. Barbara Mays's parents' surname name was changed from Coker to Hill in the film.
8502272	http://en.wikipedia.org/wiki/Engels-2	Engels-2. Engels Air Force Base (also given as Engels-2 or Engel's) is a strategic air base in Russia located east of Saratov. Engels is a major bomber operations base, and is Russia's sole operating location for the Tupolev Tu-160 strategic bombers. The base contains a runway and about 10 large revetments. It is named after the Communist philosopher, Friedrich Engels. History. In 1930, 1.5?km from the town of Engels, in a vacant lot, the construction of a military pilots school began. The 14th School of Pilots was activated at Engels on December 15, 1930. Around 10,000 people worked on the site. On February 16, 1932 the first airplane, a Polikarpov U-2 used the site. Reportedly that same day the school was renamed the Engels School of Pilots. By 1936 the Engels military aviation school was one of the best flight schools in the country. Students flew Polikarpov U-2, Polikarpov R-5 and CSS aircraft. Prior to the Second World War the school trained several thousand pilots. Many of them fought in the Spanish Civil War, participated in the Battles of Khalkhin Gol and the Soviet-Finnish War (1939-1940). For participation in the fighting seven pupils were named Heroes of the Soviet Union. At the beginning of the Second World War the school had in service Polikarpov U-2, ANT-40, Pe-2, and others aircraft. During the war years the Engels Flying School sent to the front 14 regiments. Among them were three women's regiments (including the Night Witches), in which served Major Marina Raskova. 190 pupils of the school were awarded the title of Hero of the Soviet Union for combat exploits. In the early 1950s, the construction of the new "Engels-2" airport with a concrete runway with a length of 3?km and a width of 100m was begun, and therefore, by September 1954 the Engels school was moved to the city of Tambov. On December 15, 1954, the 201st Heavy Bomber Aviation Division was established, comprising the 79th, 1096th and 1230th Heavy Bomber Aviation Regiments (TBAPs). The personnel of the regiments was assembled by choosing the best specialists of the Long Range Aviation, graduates of military schools and academies. The first Myasishchev M-4 bombers arrived in Engels on February 28, 1955. In May 1957 the first modernised 3M bomber arrived. In 1957, the 79th Heavy Bomber Aviation Regiment was transferred to Ukrainka and was transferred to the 73rd Heavy Bomber Aviation Division. Gradually the M-4 and 3M bombers were converted into aerial refuelling tankers. Air refueling significantly increased the range of the bombers, which expanded their capacity. Around 1960, the 1230th Heavy Bomber Aviation Regiment was renamed the 1230th Aviation Regiment Air Refueling. The 3M bombers were part of Long Range Aviation until 1985, and then were destroyed in accordance with the agreement on the reduction of offensive weapons. The 3MS-II and 3MN-II, converted into tankers, were in service for much longer - up to the end of 1993 and before being replaced by the more advanced Il-78. The base was to have received the first production Tu-160 in 1987 but it went to Priluki, whose units had Tupolev Tu-22M experience. The first three Tu-160s not at Pryluky were incorporated into the 1096th Heavy Bomber Aviation Regiment in 1992. By 1994 Engels had five Tu-160 bombers in operation, and that same year the 1096th Heavy Bomber Aviation Regiment was redesiganted the 121st Heavy Bomber Aviation Regiment, adopting its colours and traditions. In 1998 the START I treaty exchange of information had shown it had 20 operational Tupolev Tu-95 bombers and six Tu-160 bombers, all with cruise missile capability. From 1999 to 2001 the base received eight Tu-160s from Ukraine paid for by gas price reductions. The last two arrived on 21 February 2001. The 184th Guards Heavy Bomber Aviation REgiment was reformed at the base on 1 September 2000, drawing on Tu-95MS aircraft transferred from Mozdok. By 2007 the base had 14 Tu-160 bombers, 20 Tu-95 bombers and an unknown number of Tu-22M bombers. Aircraft. The 22nd Guards Heavy Bomber Aviation Division of the 37th Air Army controlled operations at the base up until the Air Force reorganisation of 2009-10.
8502275	http://en.wikipedia.org/wiki/Soy_(Julio_Iglesias_album)	Soy (Julio Iglesias album). "Soy" is a 1973 album by Julio Iglesias. A U.S. version was released in 1980.It was released on the Alhambra label.
8502276	http://en.wikipedia.org/wiki/Good_Riddance_/_Kill_Your_Idols	Good Riddance / Kill Your Idols. Good Riddance / Kill Your Idols is a split EP by the hardcore punk bands Good Riddance and Kill Your Idols, released November 20, 2001 through Jade Tree. Reception. Johnny Loftus of Allmusic gave the EP three and a half stars out of five, remarking that "[Good Riddance's] tightly wound sound is well represented here; 'Judas and the Morning After Pill' and 'Grandstanding from the Cheap Seats' have an urgent punk traditionalism about them that's reminiscent of Bad Religion. For their part, Kill Your Idols prove that the rabid, ragged-edges sound of New York City's defiant hardcore scene is still going strong."
